{
  "schema_version": "udh.memory/1",
  "memory_id": "memory-demo",
  "kind": "procedural",
  "status": "candidate",
  "scope_type": "workspace",
  "workspace_id": "workspace-demo",
  "session_id": null,
  "task_id": null,
  "title": "입력 경계 변경 시 기존 테스트 선확인",
  "content_ref": {
    "artifact_id": "artifact-demo",
    "digest": "sha256:aaaaaaaaaaaaaaaaaaaaaaaaaaaaaaaaaaaaaaaaaaaaaaaaaaaaaaaaaaaaaaaa",
    "media_type": "text/plain"
  },
  "tags": [
    "testing",
    "workflow"
  ],
  "requirement_ids": [
    "PY-01",
    "PLAN-01"
  ],
  "evidence_ids": [
    "evidence-1"
  ],
  "authority": "derived_procedure",
  "created_at": "2026-09-15T07:00:00Z",
  "verified_at": null,
  "expires_at": null,
  "freshness_bindings": [],
  "supersedes": null,
  "release_digest": null,
  "sensitivity": "internal",
  "promotion_receipt_id": null
}
